{
  "marc_version": "1.0",
  "decision_id": "answer-001",
  "calibration_profile": "general-v1",
  "pre_capability": 0.86,
  "uncertainty": {
    "ambiguity": 0.05,
    "missing_evidence": 0.12,
    "capability_limit": 0.08,
    "evidence_conflict": 0.02,
    "safety": 0.0
  },
  "primary_source": "missing_evidence",
  "secondary_source": "capability_limit",
  "remediability": "none",
  "selected_action": "ANSWER",
  "post_answer_confidence": 0.88,
  "confidence_band": "high",
  "confidence_target": "answer",
  "recommended_next_step": "review the cited sources"
}
