{
  "marc_version": "1.0",
  "decision_id": "clarify-001",
  "pre_capability": 0.42,
  "uncertainty": {
    "ambiguity": 0.91,
    "missing_evidence": 0.2,
    "capability_limit": 0.1,
    "evidence_conflict": 0.0,
    "safety": 0.0
  },
  "primary_source": "ambiguity",
  "remediability": "user_clarification",
  "selected_action": "CLARIFY",
  "post_answer_confidence": null,
  "confidence_band": "low",
  "confidence_target": "direct_answer_suitability",
  "recommended_next_step": "ask for the jurisdiction and date range"
}
