{
  "marc_version": "1.0",
  "decision_id": "deliberate-001",
  "iteration": 1,
  "max_iterations": 3,
  "pre_capability": 0.67,
  "uncertainty": {
    "ambiguity": 0.19,
    "missing_evidence": 0.14,
    "capability_limit": 0.33,
    "evidence_conflict": 0.72,
    "safety": 0.0
  },
  "primary_source": "evidence_conflict",
  "remediability": "none",
  "selected_action": "DELIBERATE",
  "confidence_band": "medium",
  "confidence_target": "action_suitability",
  "recommended_next_step": "compare the conflicting evidence once more"
}
