{
  "marc_version": "1.0",
  "decision_id": "abstain-001",
  "pre_capability": 0.18,
  "uncertainty": {
    "ambiguity": 0.05,
    "missing_evidence": 0.45,
    "capability_limit": 0.95,
    "evidence_conflict": 0.11,
    "safety": 0.2
  },
  "primary_source": "capability_limit",
  "remediability": "none",
  "selected_action": "ABSTAIN",
  "confidence_band": "low",
  "confidence_target": "direct_answer_suitability",
  "recommended_next_step": "do not rely on a direct answer"
}
