{
  "marc_version": "1.0",
  "decision_id": "retrieve-001",
  "iteration": 0,
  "max_iterations": 2,
  "pre_capability": 0.48,
  "uncertainty": {
    "ambiguity": 0.08,
    "missing_evidence": 0.89,
    "capability_limit": 0.12,
    "evidence_conflict": 0.18,
    "safety": 0.0
  },
  "primary_source": "missing_evidence",
  "remediability": "retrieval",
  "selected_action": "RETRIEVE",
  "confidence_band": "low",
  "confidence_target": "direct_answer_suitability",
  "recommended_next_step": "retrieve current authoritative evidence"
}
