{
  "marc_version": "1.0",
  "decision_id": "escalate-001",
  "pre_capability": 0.31,
  "uncertainty": {
    "ambiguity": 0.12,
    "missing_evidence": 0.41,
    "capability_limit": 0.58,
    "evidence_conflict": 0.28,
    "safety": 0.93
  },
  "primary_source": "safety",
  "remediability": "human",
  "selected_action": "ESCALATE",
  "confidence_band": "high",
  "confidence_target": "action_suitability",
  "recommended_next_step": "transfer the case to an authorized reviewer"
}
