{
  "marc_version": "1.0",
  "decision_id": "tool-001",
  "iteration": 0,
  "max_iterations": 2,
  "pre_capability": 0.55,
  "uncertainty": {
    "ambiguity": 0.04,
    "missing_evidence": 0.25,
    "capability_limit": 0.82,
    "evidence_conflict": 0.02,
    "safety": 0.0
  },
  "primary_source": "capability_limit",
  "remediability": "tool",
  "selected_action": "TOOL",
  "confidence_band": "high",
  "confidence_target": "action_suitability",
  "recommended_next_step": "invoke the calculation tool and reassess"
}
